<?xml version="1.0" encoding="utf-8"?>
<!DOCTYPE COMMINIDATA SYSTEM "commini.dtd">
<COMMINIDATA>
	<AREADESC areaname="startupresources">	
		<DESC descname="startupplugins">
		<PARAS>
			</PARAS>
				<DESC descname="securityplugins">
					<PARAS>	 						
					</PARAS>
				</DESC>
				<DESC descname="requiredplugins">
					<PARAS>
						<PARA name="com.swimap.color" />
						<PARA name="com.swimap.corba" />
						<PARA name="em" />
						<PARA name="clientutilAdapter" />
						
						<PARA name="topoapp"></PARA>
						<PARA name="eam"></PARA>
						<PARA name="resource"></PARA>
						<PARA name="topoclient" />
						<PARA name="topobase" />
					</PARAS>
				</DESC>			
		</DESC>				
		
		<DESC descname="startupApplications">
			<PARAS></PARAS>
				<DESC descname="applications">
					<PARAS>
						<PARA name="AlarmMonitor"/> 
					</PARAS>
				</DESC>
		</DESC>
	</AREADESC>
</COMMINIDATA>


