<?xml version="1.0" encoding="utf-8"?>
<!DOCTYPE COMMINIDATA SYSTEM "commini.dtd">
<COMMINIDATA>
  <AREADESC>
    <DESC descname="feature">
      <PARAS>
        <PARA name="id" value="com.swimap.adapter.message.resource"></PARA>
        <PARA name="label" value="com.swimap.adapter.message.resource"></PARA>
        <PARA name="image" value="icon.gif"></PARA>       
      </PARAS>
    </DESC>
    
		<DESC descname="extra">
			<PARAS>
				<PARA name="image.loading" value="loading.gif"></PARA>
				<PARA name="image.lock" value="lockdialog.gif"></PARA>
				<PARA name="image.exit" value="logoutdialog.gif"></PARA>
				<PARA name="about.version" value="about.version"></PARA>
				<PARA name="about.desc" value="about.desc"></PARA>
				<PARA name="about.image.banner"
					value="about_banner.gif">
				</PARA>
				<PARA name="about.image.title"
					value="about_title.png">
				</PARA>
				<PARA name="about.show" value="false"/>
			</PARAS>
		</DESC>
    
    <DESC descname="plugins">
      <PARAS>
        <PARA name="com.swimap.adapter.message.resource"> </PARA>
     </PARAS>
    </DESC>
   
    <DESC descname="required-plugins">
      <PARAS>
      <PARA name="com.swimap.extension.registry"></PARA>
      <PARA name="com.swimap.adapter.message.common"> </PARA>
      <PARA name="com.swimap.adapter.message.general"> </PARA>
     </PARAS>
    </DESC>
  </AREADESC>
</COMMINIDATA>